Term,Definition (English),Term translation/transliteration in Tigrinyan,Definition in Tigrinyan,Tigrinyan definition provided by (names),Term translation/transliteration in Amharic,Definition in Amharic,Amharic definition provided by (names)
Abdomen,"The abdomen is the part of the body between the chest and pelvis. The abdomen contains such organs as the stomach, liver, spleen, pancreas, intestines and other structures.",ከብዲ,ከብዲ ማለት ኣብ መንጎ ደረትን ጭርንጭራን ዝርከብ ናይ ሰውነትና ክፍሊ እዩ,,,,
Abortion,"Abortion is the termination or ending of a pregnancy before fetal viability, which is conventionally taken to be less than 28 weeks from the last normal menstural period.",ምንፃል ጥንሲ,ትሕቲ 28 ሰሙን ዕድመ ዘለዎ ጥንሲ ምንፃል,,,,
Abscess,An abscess is a collection of pus and inflamed tissue at the site of bacterial infection.,ሕብጠት,ማይን ሙግሊ ሒዙ ዛሕበጠ ናይ ባክተርያ ቁስሊ,,,,
ACT,Artemisinin Combination Therapy only given to patients with falciparum malaria. ,,,,,,
Acute,A condition is described as acute if it begins suddenly and gets worse over a short period of time. An acute emergency is one that rapidly becomes life-threatening and that requires immediate attention after the onset of symptoms.,ቕፅበታዊ,ብሃንደበት ዝጅምርን ብሓፂር እዋን ዝጋፋሕ/ዝበኣኣስን ቕፅበታዊ ሕማም,,,,
Addiction,"The condition of being abnormally dependent on some habit, especially a compulsive dependency on psychoactive substances.When a person becomes unable to function normally without using these substances, they are described as being addicted or dependent on the substance. ",ውልፍ,ንዝተፈላለዩ መድሓኒታትን ዕፅዋትን ሱስ ተፀሚዱ ዕለታዊ ስራሕቱ ብኣግባቡ ዘይሰርሕ ውልቀ ሰብ ዉልፍ ይበሃል,,,,
ADHD,"Attention Deficit Hyperactivity Disorder.Children with ADHD are restless and experience difficulties concentrating on tasks at hand. They often have problems sitting through class. They also tend to do things impulsively, without thinking much about the possible consequences of their actions.",,,,,,
Adherence,"Adherence to treatment, that is taking all the doses that are given, is very important for successful treatment outcome. ",ግቡእ ክትትል,ብሰብ ሞያ ጥዕና ዝውሃብ ምኽሪ አወሳስዳ መድሓኒት ተግባራዊ ብምግባር ግቡእ ክትትል ምግባር,,,,
Adolescence,"A period of rapid physical growth (10-19 years age group). Adolescence increases requirements of energy, protein, calcium, phosphorus and zinc. ",,,,,,
Adolescent,The World Health Organization (WHO) defines an adolescent as an individual in the 10-19 years age group and usually uses the term young person to denote those between 10 and 24 years. ,ኣባፅሕ,ከም ውድብ ጥዕና ዓለም ካብ 10-19 ዓመት ዕድመ ዘለዎም ሰባት ኣባፅሕ እንትብሃሉ ካብ 10-24 ዓመት ዕድመ ዘለዉ ድማ መናእሰይ ይበሃሉ,,,,
Adulteration,"Adulteration is when the normal content of the food has been intentionally changed by adding something to it that is not essential; for example, diluting milk with water and selling it as whole milk. Adulterated food could be unsafe for a number of reasons. These include poor nutrition; watered-down milk is not as nutritious as whole milk.Unsafe ingredients may have been used, for example unclean water or other harmful ingredients might have been added.",ሕዋስ,ኣብ ሓደ ንፁህ ዝኾነ ምግቢ ወይ መድሓኒት ኮነ ኢልካ ካሊእ ዓይነት ኣካል ምውሳኽ ወይ ምሕዋስ,,,,
Advice,Communication that you have with your client or couple in order to help them arrive at voluntary and informed decisions. ,ምኽሪ,ተገልገልቲ ሕክምና ዝኾኑ ውልቀ ሰባትን ተፃመድትን ፈሊጦም ንክውስኑ ዝሕግዝ ሞያዊ ምኽሪ ምሃብ,,,,
Advocacy,"Advocacy is the act of delivering an argument so that you can gain commitment from your political and community leaders, and help your community organise itself to face a particular health issue.Advocacy is about helping you to speak up for your community; to make sure that the views, needs and opinions of your community are heard and understood. ",ምድጋፍ/ንቅናቄ,ኣብ ሓደ ጉዳይ መሰረት ጌርካ ናይ ፖለቲካን ካልኦት መራሕትን ከምኡ ውን መላእ ሕብርተሰብ ደገፍ ንክገብር ምልዕዓል ምግባር,,,,
Advocates,Advocates are skilled negotiators and consensus builders who look for opportunities to win modest but strategic policy gains. ,,,,,,
AED,"Antiepileptic drugs (AED). It can take some time to find the right type of AED, and the correct dose, before the seizures are brought under control. ",,,,,,
Aeration,Aeration means to mix air with the water. It is used to remove volatile (easily evaporated) substances from drinking water. ,,,,,,
Aerobic,"Microorganisms that require oxygen in order to survive. Example:Escherichia coli, a faecal bacterium which grows readily on many foods.  ",ኦክስጅን ዘድልዮ,ንክነብሩን ንክራብሑን ኦክስጅን ዘድልዮም ባክተርያታት አይሮቢክ ባክተርያ ይበሃሉ,,,,
Affordable,"Affordable: The mother and family, with available community and/or health system support, can pay for the costs of the feeding option, including all ingredients.
",ፍትሓዊ ዋጋ,ብርትዓዊ ዋጋ ናይ ምግዛእ ዓቕሚ,,,,
AFP,"Acute flaccid paralysis (AFP), which is the sudden onset of severe weakening or loss of muscle tone in the legs, arms or hands. ",ቕፅበታዊ ለምሲ,ሃንደበታዊ ዝኾነ ናይ ጅማት ምድኻምን ምልማስን,,,,
AIDS,Acquired Immunodeficiency Syndrome (AIDS) is the collection of diseases that results from HIV infection.,ኤድስ,ብቫይረስ ዝመፅእ ናይ ሰውነት ናይ ምክልኻል ዓቕሚ ዘዳኽም ሕማም,,,,
Algorithm,"An algorithm is a set of guidelines that enables you to follow the steps in a prescribed course of action, with pathways at each step depending on the results. ",መላ/መምርሒ,ሓደ ተግባር ንምፍፃም ወይ ንምስራሕ ዘኽእለካ ናይ አሰራረሓ ቅደም ስዓብ ዝሓዘ መምርሒ,,,,
Allergens,"Any substance that induces an allergic reaction. Examples of allergens include: Pollen from trees, crops and flowers, house dust.  ",አለርጅክ,ናይ ሰውነት ቁጣዕ ንኣብነት ከም አስሚ ዝኣመሰሉ ነገራት ክለዓል ዝገብሩ ነገራት አለርጅን ይበሃሉ,,,,
Altitude,Altitude is the height/elevation above sea level. It is one of the most important factors that determines the pattern of malaria transmission in Ethiopia.,ብራኸ,ካብ ፀፍሒ ባሕሪ ንላዐሊ ዘሎ ብራኸ,,,,
Ambu-bag,A hand-operated pump. It pumps air into the baby's lungs through a mask fitted over its nose and mouth.,ኣምቡ ባግ,ብኢድ ዝሰርሕ ስርዓተ ምትንፋስ ዝሕግዝ መሳርሒ,,,,
Amenorrheaic,Absence or abnormal stoppage of menstruation,ወርሓዊ ፅግያ ዘየርአየት,ወርሓዊ ፅግያ ከየርአየት/ዝሓለፋ ሰበይቲ,,,,
Amenorrhoea,Absence or abnormal stoppage of menstruation,አልቦ ወርሓዊ ፅግያ,ወርሓዊ ፅግያ ዘይምምፃእ,,,,
Amoxicillin,Penicillin antibiotic of similar action to ampicillin.,,,,,,
Ampoule,A sealed sterile glass or plastic bottle with a thin neck for storing liquids for injection. The ampoule has to be broken open at the neck before the vaccine can be used for injection.,ብልቃጥ,ንፁህ መድሓኒት ዝሓዘ ብጎማ ዝተዓሸግ ብልቃጥ,,,,
Anaemia,A condition in which there is not enough haemoglobin in the blood. Haemoglobin is the red substance in the red blood cells which carries oxygen. ,አነምያ,ዋሕዲ ደም ማለት እውን ብሕፅረት ቀይሕ ዋሕዲ ደም ወይ ብሕፅረት ሄሞግሎቢን ዝመፅእ,,,,
Anaerobic,Microrganisms that do not need oxygen to survive. ,ኦክስጅን ዘየድልዮ,ንምንባርን ንምርባሕን ኦክስጅን ዘየድልዮም ባክተርያታት,,,,
Anterior,Situated at or towards the front. ,ፊት ንፊት,ፊት ንፊት ዝርአ ናይ ሰውነት ክፍሊ,,,,
Anthropometry,"The study of human body measurement for use in anthropological classification and comparison. Anthropo: 'human', metry: 'measurement'. ",ኣንትሮፖሜትሪ,ሕፅረት ምግቢ ምህላውን ዘይምህላውን ንምፍላጥ ዝግበር ናይ ርእስን ኩርናዕን ዓቐን,,,,
Antibiotics,"Medicines that destroy bacteria, or stop them from multiplying in the body. ",ፀረ ተሃዋስያን,ንደቀቕቲ ተሃዋስያን ብፍላይ ንባክተርያ ዕብየት ዝዓግትን ዝቐትልን መደሓኒት,,,,
Antibodies,Small proteins that are made by the body's immune system and that recognise and help get rid of foreign organisms and toxins.,ኣንቲቦዲ,ኣብ ደም ውሽጢ ዝርከቡ ሕማማት ንምክልኻል ዝሕግዙ ፕሮቲናት,,,,
Antigens,Any foreign susbstance that causes an immune response.,ኣንቲጀን,ኣብ ደም ውሽጢ ዝርከቡ ሕማም ከምፅኡ ዝኽእሉ ናይ ወፃኢ ፕሮቲናት,,,,
Antiretrovirals (ARVs),Any drug that works against a retrovirus. HIV is a retrovirus.,ፀረ ቫይረስ,ንኤድስ ሕሙማት ዝውሃብ ናይ ኤችኣይቪ መድሓኒት,,,,
Anxiety,"Anxiety is when a person worries too much about something, for example their health, their problems, or even what will happen in the future. ",ጭንቀት,ብዛዕባ ሓደ ጉዳይ ካብ መጠን ንላዐሊ ምሕሳብን ምጭናቕን,,,,
AOM,"Acute otitis media (AOM) is a severe infection of the middle ear, lasting less than two weeks. It is very common in babies and young children, but is rarely seen in adults. ",ሕማም እዝኒ,ብባክተርያ ዝመፅእ ብፍላይ ኣብ ህፃናት ዝርኣይ ናይ ማእኸላይ እዝኒ ሕማም,,,,
APH,Antepartum haemorrhage (APH) or late pregancy bleeding. It is an important cause of maternal and fetal death and needs the attention of a highly skilled heathcare provider. ,ምድማይ,ድሕሪ ጥንሲ ዘጋጥም ናይ ማህፀን ምድማይ /ብፍላይ ድሐሪ 7ወርሒ ዘጋጥም ምድማይ,,,,
Appeal,A message that is likely to persuade or convince people. ,ስሓባይ,ስሓባይ ብዝኾነ መልክዕ መልእኽቲ ምትሕልላፍ,,,,
Appendicitis,Appendicitis is an acute condition which occurs as a result of inflammation of the appendix. ,ትርፊ አንጀት,ናይ ትርፍ አንጀት ሕማም,,,,
Appendix,"A small tube, closed at one end, which is found at the junction between the small and the large intestine.",,,,,,
Aquifers,"An underground layer of permeable rock, sediment or soil that yields water.",ፀፍሒ,ማይ ዝዓረፈሉ ታሕተዋይ ኮክሒ,,,,
Arborloo,"A simple form of ecological sanitation. This consists of a single, unlined shallow pit with a portable ring beam (circular support), slab and superstructure. It is used like a normal latrine but with the regular addition of soil, wood ash and leaves. ",ኣርቦርሉ,ቀሊልን ብሕሳር ዋጋ ዝስራሕን ዓይነ ምድሪ ኮይኑ ንማዳበርያ ከም ዝጠቅም ተገይሩ ዝተሰርሐ,,,,
ARIs,"Acute respiratory tract infections (ARIs) are bacterial or viral infections of the respiratory tract leading to breathing difficulties, fever and other complications, including infections in the ear and the membranes surrounding the brain. ",ሃንደበታዊ ናይ መተንፈሲ ሕማማት,ብባክተርያ ወይ ብቫይረስ ዝመፅእ ሃንደበታዊ ናይ መተንፈሲ ኣካላት ሕማም,,,,
ART,"The treatment used for HIV-positive people. It consists of giving drugs termed antiretrovirals (ARVs), which work by attacking the human immunodeficiency virus (HIV) itself. ",,,,,,
Artery,Blood vessles that carry oxygenated blood from the heart to various parts of the body. ,ቀዳሒ ደም,ደም ካብ ልቢ ዝወስድ ዓይነት ደም ትቦ ኮይኑ ዝበዝሐ ፀቕጢ ደም ዝርአየሉ,,,,
Arthropods,"An invertrabrate animal having an external skeleton, a segmented body and jointed apendages/limbs. E.g. insects such as flies and other creatures such as mites that transmit disease.",ዓንዲ ሑቐ ዘይብሎም ነፍሳት,ዓንዲ ሑቐ ዘይብሎም ነፍሳት,,,,
Ascariasis,"Infection of the small intestine with a helminth parasite called Ascaris lumbricoides. Causes discomfort, indigestion, weakness, and sometimes blocking of the gut.",ወስፋት,ናይ ወስፋት ሕማም,,,,
Asphyxia,A condition of severe shortage of oxygen to the body that arises from being unable to breathe normally. Asphyxia in the uterus is due to an inadequate supply of oxygen from the mother's blood or a problem in the placenta. ,ኣስፊክዝያ,ብሕፅረት ኦክስጅን ዝመፅእ ሽግር ኮይኑ ክሳብ ውነ ምስሓትን ሞትን ክበፅሕ ይኽእል,,,,
Aspiration (Vacuum),Abortion/Pregnancy Termination using an instrument like a syringe operated by hand that creates a negative pressure to suck out the contents of the uterus.,ምውጋድ,ዝመጥጥ መሳርሒ ብምጥቃም ካብ ውሽጢ ሰብነትና አየርን ፈሳሲን ምውጋድ,,,,
Assess,"The gathering of information about a patient's status (physcial, psychological, sociological).",ምምርማር,ወሰንቲ ምልክታት ምዝባዕ ጥዕና መሰረት ጌይረካ ምርመራ ጥዕና ምግባር,,,,
Assessment,See Assess,ምርመራ/ዳህሳስ,ወሰንቲ ምልክታት ምዝባዕ ጥዕና መሰረት ጌይረካ ምርመራ ጥዕና ናይ ምግባር ኹነት,,,,
Attitudes,Attitudes are relatively constant feelings directed toward something or someone that contains a judgment about whether that something or someone is good or bad.,አመለኻኽታ,ብዛዕባ ሓደ ጉዳይ ዘለካ አመለኻኽታ ወይ ስምዒት/ ብፅቡቕ ይኹን ብሕማቕ,,,,
Autism,"Autism is a neurodevelopmental disorder characterized by impaired social interaction, verbal and non-verbal communication, and restricted and repetitive behavior. Parents usually notice signs in the first two years of their child's life.",ኦቲዝም,ኣብ እዋን ቁልዕነት ዝርአ ናይ ምዝራብን ናይ ምርድዳእን ፀገም,,,,
Autoclave,An autoclave is a device used to sterilize equipment and supplies by subjecting them to high pressure saturated steam at 121°C for around 15–20 minutes depending on the size of the load and the contents.,ኣውቶክሌቭ,ደቀቕቲ ተሃዋስያን ምሉእ ንሙሉእ ንምውጋድ ወይ ንምምካን ዝጠቅም መሳርሒ,,,,
Autolysis,"Destruction of a cell through the action of its own enzymes. Also known as 'self-digestion'. 
",ዓርሰ ብርሰት,ናይ ዋህዮታት ወይ ቲሹ ዓርሰ ብርሰት ወይ ዓርሰ ጥፍኣት,,,,
Autonomy,"The term refers to every individual's right of self-determination, independence and freedom to make their own choices. ",ነፃነት,ካብ ናይ ካልኦት አካላት ፀቕጢ ነፃ ኮይንካ ምውሳን,,,,
Axillary,"Related to the axilla (Armpit)
",ኩኩዒት,ኢድን ደረትን ዝራኸብሉ ትሕታዋይ ክፋል ኣካል ወዲሰብ,,,,
Bacteria,Unicellular organisms (made of one cell) and are very small in size.,,,,,,
Basic,Pure. Forming a base or starting point. E.g. Basic research is designed to extend knowledge for the sake of understanding itself and discovering new knowledge and understanding is the objective.,,,,,,
Behaviour,"Behaviour is an action that has a specific frequency, duration and purpose whether conscious or unconscious. It is what we do and how we act. People stay healthy or become ill often as a result of their own action or behaviour. ",,,,,,
Beliefs,"Beliefs are convictions that something is real or true. Statements of belief about health include such negative comments as, 'I don't believe that exercising is good for you'.",,,,,,
beneficence,"The term beneficence tells you about 'doing good' for your client, for instance by providing immunization. ",,,,,,
Benefits,"Something helpful, favourable, or profitable. ",,,,,,
Bias,An opinion or influence that strongly favours one side in an argument or one item in a group,,,,,,
Biodegradable,Able to be broken down by bacteria in the environment. Can be recycled or reused.,,,,,,
Biogas,"Biogas is a gas produced  by  he breakdown of organic matter in  the  absence  of oxygen. It is a renewable energy source, like solar and wind energy. Biogas can be produced from regionally available raw materials and recycled waste and is environmentally friendly. Biogas can be used for cooking and lighting energy. ",,,,,,
Biomass,"Biomass is any biological material from living or recently living plants that is used to generate energy,",,,,,,
Biopsy,The removal and examination of tissues from the living body to determine the existence or cause of a disease. It involves the microscopic examination of a small specimen of tissue extracted from the patient's body. ,,,,,,
Biopsychosocial,"Combination of biological, psychological and social problems. Mental health professionals have developed a model of mental illness called the 'biopsychosocial' model. ",,,,,,
Biosolid,Biosolids is a term that is typically used to describe several forms of treated sewage sludge that is intended for agricultural use as a soil conditioner. ,,,,,,
Blanching,A mild pre-cooking operation which can reduce the bacterial load on vegetables by 90%. ,,,,,,
Blastocyst,Hollow ball of cells after five days of fertilisation (just before implantation of the embryo).,,,,,,
Blood,"Blood is a fluid comprising red blood cells, several types of white blood cells and small fragments of blood cells called platelets, which are involved in the blood clotting process. These cells are all suspended in yellowish or straw-coloured liquid called plasma. ",,,,,,
BMI,Body Mass Index or the relationship between weight and height. Your BMI is defined by your weight in kilograms divided by your height in metres and the result is divided again by your height in metres. ,,,,,,
Boiling,Boiling is the process of applying heat to water until the temperature reaches about 100°C. ,,,,,,
Borrow-pits,"Also known as a sand box. It is a term used in construction and civil engineering. It describes an area where material (usually soil, gravel or sand) has been dug for use at another location.Borrow-pits used to extract soil and stones for construction are very common in rural Ethiopia inside and outside villages.  ",,,,,,
BP,Blood pressure (BP) refers to how hard the blood is 'pushing' on the walls of the major blood vessels as it is pumped around the body by the heart. ,,,,,,
BP-100,An RUTF (Ready to Use Therapeutic Food) wheat and oat biscuit.,,,,,,
Bronchioles,Passageways that carry air into all parts of the lungs. They are branches of the bronchi. ,,,,,,
Brow,The area of skull which extends from the anterior fontanel to the upper border of the eye. ,,,,,,
Bundling,"The practise of organising stock all together in ""bundles"".",,,,,,
Burn,"Damage, hurt or destroy by fire.",,,,,,
Calcification,"The accumulation of calcium salts in the body tissue, normally in the formation of the bone. E.g. Calcification of the skeleton ",,,,,,
Canning,One of the most widely used modern methods of processing and preserving food. It involves the careful preparation of food packed into a sealed tin. ,,,,,,
Cannula,"A tube or hollow needle that can be inserted into a vein, often for the delivery or removal of fluid or for the gathering of data. ",,,,,,
Capillaries,"Capillaries are the smallest blood vessels in the body, having an internal diameter hardly larger than the diameter of a single red blood cell.  ",,,,,,
Caput,A large swelling over the fetal skull in the area that was pressed against the cervix during labour and delivery. ,,,,,,
Carbohydrates,"Starchy foods such as Injera, bread, potatoes, rice and cereals.Carbohydrates are referred to as energy-giving foods. They provide energy in the form of calories that the body needs to be able to work, and to support other functions. Carbohydrates are needed in large amounts by the body. Indeed, up to 65% of our energy comes from carbohydrates. ",,,,,,
Carriers,"Individuals who are infected, but who do not have clinical manifestations. Carriers and active cases can both transmit the infection to others. ",,,,,,
Case,An individual who has a particular disease. ,,,,,,
Cataracts,"Cataracts are changes in clarity (clouding) of the lens in the eye, which interferes with the passage of light into the eye. As the lens gets increasingly cloudy (opaque), less and less light can get through it. ",,,,,,
Catheter,"A thin tube inserted into a body cavity to drain fluid, especially into the bladder to extract urine. The procedure is called catherisation. ",,,,,,
Cavity,"A cavity is a space in the human body which contains different organs, fluids and other structures. ",,,,,,
Cells,"Cells are the tiny building blocks of living matter, which can only be seen through a microscope. ",,,,,,
Census,A census is a collection of information on everyone in a population.,,,,,,
Cervix,The narrow neck at the upper end of the vagina. ,,,,,,
Channel,A channel is the physical means or the media by which the message travels from a sender to a receiver. The channel used to communicate a health message influences what information can be conveyed and how. ,,,,,,
Chemoprophylaxis,"Chemo' refers to medical drugs, and 'prophylaxis' means 'an action taken to prevent a disease'. Chemoprophylaxis refers to the drugs given to exposed and susceptible hosts to prevent them from developing an infection. ",,,,,,
Chemotherapy,Treatment of disease by medicinal drugs and other chemical substances.,,,,,,
Chilling,"Chilling involves reducing food temperatures, but only to approximately -1ºC. Refrigerators for cold storage/chilling are normally used at 0ºC to +8ºC. ",,,,,,
Chlamydia,"Chlamydia is also one of the most common Sexually Transmitted Infections (STIs), and is caused by bacteria called Chlamydia trachomatis. ",,,,,,
Chloasma,"In pregnant women, darkening of the skin over the forehead, bridge of the nose, or cheekbones.",,,,,,
Chlorination,"One of the most effective and widely used methods for disinfecting water and making it safe to drink. Whatever the level, it is important that the correct quantity of chlorine is added to remove all impurities. ",,,,,,
Choice,"Choice' is to decide freely whether to use contraception and, if so, which method. ",,,,,,
Choking,"Choking is defined as an obstruction of the upper part of the windpipe (trachea) resulting in an acute life-threatening emergency. A person whose airway is obstructed will quickly become unconscious and die due to suffocation (lack of oxygen), unless the obstruction is quickly removed.",,,,,,
Cholera,An acute diarrhoeal disease that affects the intestines and can kill vulnerable patients within a few hours if they are not treated quickly. ,,,,,,
Chronic,Long-term of frequently recurring. A chronic diease is one that lasts a long time.   ,,,,,,
Classification,"Arrange systematically in classes or groups. E.g. IMNCI classifications are action-oriented illness categories which enable a healthcare provider to determine if a child should be urgently referred to a health centre, or can be treated at home. ",,,,,,
Cleanliness,"Refers to cleaning:  removing dirt, wastes or unwanted things from the surface of objects using detergents and necessary equipment. ",,,,,,
Cluster,"A larger-than-expected number of cases with similar symptoms, but without clear evidence (at this time) that they are connected in any way.",,,,,,
Co-infection,Simultaenous infection of a single cell by two or more virus particles. A globally common coinfection involves tuberculosis and HIV. ,,,,,,
Coagulation,The formation of particles in a liquid by adding chemicals. ,,,,,,
Colostrum,The first milk a mother's breasts produce. It is yellowish in colour.  It is rich in nutrients for the baby and also has maternal antibodies which protect the newborn from infection.,,,,,,
Comfort,A state of being at ease and content. ,,,,,,
Communication,"The transmission of information from one person to another, or from a source to a destination. ",,,,,,
Community,"A group of people, based on common values and norms, who live within a geographically defined area and who share a common language, culture or values.",,,,,,
Component,Each of the parts of which a thing is being composed (formed).,,,,,,
Compost,"A mixture of plant and animal waste that is allowed to rot for use as a fertiliser. Hay, dead leaves, vegetable waste, animal droppings, and manure all make good compost.",,,,,,
Composting,Composting is a controlled process in which this type of waste is collected in an open pit or heap and is decomposed by natural biological processes.,,,,,,
Conditions,An illnesss or abnormality.  ,,,,,,
Conduction,"The loss of heat. E.g. Newborns lose heat by conduction when placed on a cold table, or weighing scale. ",,,,,,
Confidentiality,To be assured that any personal information will remain confidential or private. It is the control of disclosure of personal health information and limiting access of these personal matters to others. ,,,,,,
Confusion,The state of being unclear in one's mind about something. ,,,,,,
