Psychosis,"hem all, either in this study session or in a later one. Box 10.1 Priority mental health disorders (WHO) Psychosis: this is the collective name for a group of serious disorders characterised by changes in behaviour (for example poor self-care, restlessness), stran",,,,,,
PTB,"s TB bacteria or tubercle bacilli. TB usually affects the lungs (80% of TB cases are of this type), hence the name pulmonary TB (PTB). When other organs of the body are affected, such as the bones, joints, lymph-nodes, gastro-intestinal tract, meninges (coverings of the brain), or ",,,,,,
Puberty,"Puberty is the time in which sexual and physical characteristics mature (see Figure 1.3). The exact age a child enters puberty depends on a number of different things, such as genes, nutrition and sex. Most girls and boys enter puberty between 10-16 years of age although some start earlier or later. Gir",,,,,,
puerperium,"ostnatal changes that occur to women during the six weeks after childbirth. The postnatal period is also known by doctors, nurses and midwives as the puerperium. It includes the normal processes of physical and psychological adjustments during this period. Do you remember the physiological changes in pregnanc",,,,,,
puerperium,"FILE@@/Fig3.png"" height=""171"" width=""200"" /> As you learned in Study Session 2, the course of the puerperium goes smoothly in most women. The puerperium is the period of about six weeks after the birth, in which physiological adjustment to the non-pregnant state occurs. However, sometimes women will d",,,,,,
pulp,"Tooth pulp is the deepest part of the tooth structure, where nerves and blood vessels are found (look back at Figure 6.2). If it becomes diseased or injured and can't repair itself, the tooth dies and will soon fall out. The most common cause of pulp death is a cracked tooth or a deep cavity. Both of",,,,,,
pupil,"controls the amount of light that enters the eye through the pupil. The central opening in the ring-shaped muscular tissue of the iris is called the pupil, and the amount of light that enters the eye, can be altered by the iris changing its shape. ",,,,,,
pus,") into the ear. As the infection builds up, white blood cells crowd into the area to fight the infectious agents and the middle ear becomes filled by pus â€“ a thick whitish-yellowish fluid, formed by mucus packed with living and dead bacterial cells and debris from damaged tissue in the ear. ",,,,,,
Pus,">Neglected, resistant, or recurrent infections of the breast can lead to the development of an abscess, a collection of pus within the breast. Pus is a yellowish-white, sticky fluid formed in infected tissue, consisting of bacteria, white blood cells, cellular debris and dying tissue. Women with",,,,,,
pustules,"tal or health centre Impetigo caused by Staphylococcus bacteria in the skin, which presents as pus-filled blisters (pustules) usually seen around the umbilicus or in the nappy area. Are there many pustules? More than 10 is a general danger sign. Monilial rash",,,,,,
qualitative,elines from the woreda Health Office and held discussions with her supervisor and the kebele's community leaders. This created a mix of qualitative and quantitative data. Look at the list below. Which of these types of data are qualitative and which are qu,,,,,,
Questionnaires,"Questionnaires are a list of questions with a space under each one for the researcher to write the answers given by the respondent (the person 'responding' to the questionnaire). Alternatively, questionnaires can have several possible answers to each question and the respondent chooses which one best re",,,,,,
Questions,seven-month-old baby three times a day instead of just once a day. The mother started to give a meal and a snack and then added a third feed. Questions What stage in the behaviour change model do you think each person has reached? What could the health worker do to help each of ,,,,,,
quota,"A quota is a defined number that must be included in a sample. Quota sampling is a method that ensures that a certain number of subjects from different subgroups with specific characteristics appear in the sample, so that all these characteristics are represented. For example, you may think tha",,,,,,
Rabies,"Rabies is a severe life-threatening viral disease, transmitted to humans in saliva in the bite of infected animals, particularly those in the dog family (canines). Foxes, wolves, hyenas, bats, raccoons and skunks are also a reservoir of rabies virus, but in most countries they rarely transmit the disea",,,,,,
Radiation,"ld bed. Convection: when the baby is exposed to cool surrounding air or to a draught from open doors and windows or a fan. Radiation: when the baby is near cool objects, walls, tables, cabinets, without actually being in contact with them. ",,,,,,
Radiation,"urrounding air. Newborns lose heat by evaporation after delivery or after a bath. Even a newborn in a wet nappy can lose heat by evaporation. Radiation. This is the loss of heat from a newborn's skin to distant cold objects, such as a cold window or wall etc. Finally, knowing that the newborn",,,,,,
rape,"use them; not using an available contraceptive method because of some misconception (e.g. concerning its safety).Some pregnancies result from rape (forced sexual intercourse) and incest (sexual activity between two people who are considered, for moral or genetic reasons, too closely relat",,,,,,
Rape,"ual manner against the will of the girl/woman (e.g. kissing, grabbing, fondling) Restraining Constant criticism Rape (forced sexual intercourse) Pulling hair Expressing negative expectations Use of a weapon to force into a sexua",,,,,,
Rape,"ual manner against the will of the girl/woman (e.g. kissing, grabbing, fondling) Restraining Constant criticism Rape (forced sexual intercourse) Pulling hair Expressing negative expectations Use of a weapon to force into a sexua",,,,,,
re-infection,"Another subject that PLHIV should consider is re-infection, which refers to the situation in which a person already living with HIV is infected with a new strain of HIV from another PLHIV. Re-infection can accelerate progression to AIDS in two ways. First, re-infection can increase the viral load (i.e",,,,,,
reactivation,and signs of TB. The person is then said to have active TB. This process of progression from LTBI to active TB is called reactivation. The greatest risk for developing active TB is within the first two years following the initial infection.,,,,,,
Readiness,"Readiness implies a degree of willingness and eagerness of an individual to learn something new. Individuals learn best when they are physically, mentally and emotionally ready to learn — and they do not learn well if they see no reason for learning. Getting the audience ready to learn, creating in",,,,,,
recency,"The principle of recency states that things most recently learned are best remembered. Conversely, the further a learner is removed time-wise from a new fact or understanding, the more difficult it is to remember. For example, it is easier for a mother to recall what children were fed this morning than ",,,,,,
reconstitution,"all glass bottles called ampoules. Vaccines that come as powders must be mixed with a liquid called a diluent. This process is known as reconstitution, which means thoroughly mixing the powder with the diluent to activate the vaccine before it can be administered. Before use, you must reconstitute B",,,,,,
Reconstitution,tant to reconstitute a powder vaccine using only the diluent provided by the manufacturer specifically for that vaccine Reconstitution is the process of mixing vaccines that come as powders with the diluent provided with the vaccine. This section will also explain how to open vials a,,,,,,
Recycling,"Recycling Recycling is a process by which waste is processed in some way to be reformed into new or similar products. The principle is to make a usable product from the waste. Plastic bottles, newspapers, cardboard and tin cans can all be reprocessed and made into new items. Plastic bags can also",,,,,,
reduction,"ented in a diagram known as the waste management hierarchy (Figure 22.3) that you first met in Study Session 2. At the top of the hierarchy is reduction, which means keeping the production of waste to a minimum. Next comes reuse, which simply means using something more than once. The third opti",,,,,,
referral,"Finally, you need to know what to do if you are making a referral â€“ sending a client for additional health services and specialised care at a higher level health facility. You should complete a referral form in full and sign and date it, then make sure it goes to the health facility with the patient; i",,,,,,
refrigerator,"A refrigerator is a cooling apparatus. Health facility refrigerators may be powered by electricity, kerosene, paraffin, bottled gas or solar energy. Electric refrigerators are usually the least costly to run and the easiest to maintain, but they must have a reliable electricity supply, which is not often pos",,,,,,
regimen,"A regimen is a defined course of drug treatment. If you are already a health worker, you will be familiar with the types of anti-TB drugs used in Ethiopia. However, we will teach the regimens here in detail because they may have been updated since you learned a",,,,,,
rehydration,"dition in Study Sessions 33 and 34. For patients with diarrhoea, especially children, the core measure in the treatment is rapid and adequate rehydration â€“ fluid replacement â€“ usually by drinking fluids. In the most severe cases the fluid has to be given intravenously (directly into a vein). Rehydr",,,,,,
Relapse,"NewA patient who has never had treatment for TB, or has been on anti-TB treatment for less than four weeks. RelapseA patient who has been declared cured or treatment completed for any form of TB in the past, but who reports back to the health service and i",,,,,,
relapse,"re often put on a high dose of medication. As they get better over time a lower dose is needed to adjust to the new situation. Because of the risk of relapse (return of the previous symptoms of mental illness), the drugs should not be stopped suddenly. Similarly, people who are very sad and depressed and r",,,,,,
Relapses,"cted with P. vivax, especially for the first time, can be quite ill. However, P. vivax rarely causes complications or results in death. Relapses (return of malaria symptoms due to activation of an old infection) due to P. vivax can occur for several years. ",,,,,,
Relax,"gure 9.3 Notice the warmth shown by this body language. (Photo: Heather McLannahan) Box 9.1 ROLES R = Relax the client by using facial expressions that show interest O = Open up the client by using a warm and caring tone of voice, i.e. ",,,,,,
Relax,y respond to the needs of young people. It is good to remember ROLES when counselling young people. ROLES is abbreviation for: R = Relax the client by using facial expressions that show interest O = Open up the client by using a warm and caring tone of voice ,,,,,,
Research,"Research is the collection, analysis and interpretation of data with the aim of answering certain questions or solving certain problems. Health research is aimed at investigating health-related problems systematically and using this knowledge to design better solutions for these problems. I",,,,,,
research,Research can be basic or applied depending on its objectives. Basic (or pure) research is designed to extend knowledge for the sake of understanding itself. The results may not have any applications â€“ discovering new knowledge and understanding is the objective. Applied research is carrie,,,,,,
reservoir,"er animals, or for example in soil or water. The place where the infectious agent is normally present before infecting a new human is called a reservoir. Without reservoirs, infectious agents could not survive and hence could not be transmitted to other people. Humans and animals which serve as reserv",,,,,,
reservoir,"general speech, refers to artificial lakes that have been constructed to store water at the surface. In the context of the water cycle and hydrology, reservoir means all stores of water. Another term included in Figure 13.3 is transpiration, which is the release of water vapour (water as a gas) from p",,,,,,
Resources,o be done by model households. The strategy is to train a Health Extension Practitioner who will then train the model households. Resources Health Extension Practitioner X will deliver refresher training on hygiene and sanitation to households. Organisation,,,,,,
Respirators,e in the prevention of TB is the N95 class of respirator (also recommended by the WHO); examples of this type of respirator are shown in Figure 17.3. Respirators have very small pores (too small to see with the naked eye) that allow the wearer to breathe but prevent infectious agents from passing through (they,,,,,,
respondent,munity survey.,,,,,,
respondent,"a group. This is a face-to-face or personal interview method and requires a person, the interviewer, asking questions to the other person, the respondent. The questions are usually initiated by the interviewer who then records the responses, as shown in Figure 12.2. ",,,,,,
retina,"The retina is a complex layer of tissue at the back of the eye, where the image from the light entering the eye is focused. When light hits the retina, it send signals to the brain along the optic nerve. The brain interprets these signals and turns them into information about what the eye is seeing. Da",,,,,,
retroviruses,"illing the host cell as it sheds its load of viruses into the body.There are different types of viruses, and HIV belongs to a group called the retroviruses. This name is important because the drugs that have been developed in recent years to treat PLHIV are called antiretrovirals (or ARVs),",,,,,,
reuse,"met in Study Session 2. At the top of the hierarchy is reduction, which means keeping the production of waste to a minimum. Next comes reuse, which simply means using something more than once. The third option in the hierarchy is recovery, which includes several separate processes t",,,,,,
Risk,"to clarify the difference between hazard and risk. A hazard is something which is known to cause harm, that is, a source of danger to health. Risk is the likelihood or probability of the hazard occurring and the magnitude of the resulting effects. For example, if you climb a ladder you know ther",,,,,,
Risks,d with exclusive replacement feeding. These are set out in Box 12.4. Box 12.4 Exclusive replacement feeding Risks Increased risk of serious diarrhoeal infections and malnutrition leading to higher rates of early death Inadequate supply of,,,,,,
rotaviruses,"In this section, we will briefly mention the viruses that cause diarrhoeal diseases. The most prevalent infectious agents in this category are the rotaviruses. The WHO estimates that about 40% of all cases of severe infant diarrhoea worldwide, and at least 500,000 deaths in childhood from diarrhoeal disease",,,,,,
Runoff,". Precipitation simply means water falling from the atmosphere to the Earth's surface; mostly this means rain, although it also includes snow. Runoff includes all water that flows, under the force of gravity, across land in streams and rivers and across the surface, for example, of a field. Grou",,,,,,
sacrum,ant landmark for labour and delivery.,,,,,,
Safe,formula milk or animal milk. Sustainable: the mother is able to prepare feeds for the child as frequently as recommended. Safe: the formula milk should be safe for the health of the infant. Figure 27.3 illustrates the AFASS decision pathway used to determine h,,,,,,
Safe,and uninterrupted supply of all ingredients and commodities needed to implement the feeding option safely for as long as the infant needs it. Safe: Replacement foods are correctly and hygienically prepared and stored in nutritionally adequate quantities; infants are fed with clean hands using cl,,,,,,
Safety,"ity, age, and marital or economic status. Choice â€” to decide freely whether to use contraception and, if so, which method. Safety â€” to have a safe abortion and to practise safe, effective contraception. Privacy â€” to have a private environment during counselli",,,,,,
saliva,"ked; they are clean and without signs of decay. The tongue and gums are clean and pink, without any greyish coating, bleeding, sores or swelling. The saliva that keeps the mouth moist should be a clear fluid, not thick or coloured white or greenish, which is a sign of infection. The breath emerging from t",,,,,,
Salt,ins sugar and tends to increase blood glucose levels. People are often surprised at this because fruit is a healthyeating option. Salt A small amount of salt daily is all that is needed; this can mostly be obtained from fresh natural foods. Most people eat more salt,,,,,,
Salting,"lting, sugaring and smoking are all methods of curing foods. Curing is a general term that covers all these types of food preservation. Salting is the addition of salt (sodium chloride or NaCl) to food for the purpose of preservation. The growth of microorganisms is inhibited by the salt, whi",,,,,,
sample,"rest is therefore not usually possible. For this reason, researchers usually study a representative number of the whole population, which is called a sample. To achieve a representative sample for a research study, the people who will be studied (i.e. the subjects) have to be carefully selec",,,,,,
Sampling,"Sampling is the process of selecting a number of study subjects from a defined study population (i.e. the population being investigated). In most research projects it is not possible to include all the study population in the research design. Therefore, you need to look at a sample of individuals ",,,,,,
Sanitation,"ledge and understanding of hygiene and associated health risks in order to help people change their behaviour to use better hygiene practices. Sanitation means the prevention of human contact with wastes, for hygienic purposes. It also means promoting health through the prevention of human contact with",,,,,,
sanitising,oap must be taken away by thorough rinsing. Then place the dish into the third bowl. The process of dish washing in the third bowl is called sanitising which is a procedure to inactivate and remove the microorganisms that may be found on the surface of the dish. Sanitising is possible by rinsing the ,,,,,,
SC,ation routes are: Intradermal (ID): the vaccine is injected into the top layers of the skin. Subcutaneous (SC): the vaccine is injected into the fatty tissue below the skin and above the muscle. Intramuscular (IM): the vaccine is inject,,,,,,
SC,"hildren, as in Ethiopia, vitamin A drops are given at the same time as measles vaccine, as described in Study Session 3. Subcutaneous (SC) injections are given into the fatty tissue below the skin and above the muscle. Measles vaccine is the only routine EPI vaccine which is administere",,,,,,
Scabies,"Scabies (ekek in Amharic) is a parasite infestation of the skin caused by microscopic mites, Sarcoptes scabiei (Figure 39.12). These tiny animals are spread principally by direct skin-to-skin contact (e.g. during close physical contact between children and parents, or during ",,,,,,
Scar,"enting 'head-down'. If it is round like a ball, it may indicate an abnormal presentation (as you will learn below, and in Study Session 8). Scar: Observe if she has a scar from an operation in the lower abdomen, from a previous caesarean delivery (Figure 2.3); the scar will usually be just abo",,,,,,
Scarring,joined/fused together). Physical obstruction preventing the baby from descending (e.g. a tumour in the abdomen or uterus). Scarring of the uterus (which we referred to in the introduction to this study session). The first four causes have already be,,,,,,
Schizophrenia,"lapse, people with chronic psychoses may have symptoms similar to acute psychoses. A common form of chronic psychosis is called schizophrenia. Schizophrenia is a severe, chronic mental illness that affects about one in a hundred people at some point in their lives. As with other psychoses, they experience",,,,,,
sclera,"The sclera is a tough, leather-like, white tissue that extends all around the eye. Similar to an eggshell surrounding an egg and giving its shape, the sclera surrounds the eye and gives the eye its shape. The sclera is also attached to small muscles around the eye, which, in turn, move the eye left and",,,,,,
Screening,ing Issues related to HIV/AIDS will be further discussed in Study Sessions 20â€“30 later in this Module. Screening refers to the detection of an infection in an individual who does not show any signs or symptoms of the disease. It is carried out using specific tes,,,,,,
scurvy,"k, liver, kidney and heart Whole grain cereals, meat, whole bread, fish, bananas Vitamin C Prevention of scurvy Aiding wound healing Assisting absorption of iron Fresh fruits (oranges, banana, mango, grapefruits, lemons, potatoes",,,,,,
Scurvy,"issue lining the gut, respiratory and genitourinary systems. Calcification refers to the hardening of bones by calcium deposits. Scurvy is a disease caused by vitamin C deficiency which leads to sore skin, bleeding gums and internal bleeding. ",,,,,,
Sedimentation,eam and removed from the water. Aeration can be carried out in towers or aeration basins to provide the necessary contact time between air and water. Sedimentation is the settling out of comparatively heavy suspended material (suspended solids) in water because of gravity. The settling takes place in a quiet pon,,,,,,
Sediments,Sediments consist of fine particles of mostly inorganic material such as mud and silt washed into a stream as a result of land cultivation and construction. They may also arise from demolition and mining operations where these activities take place. The presence of solid particulate material suspended in ,,,,,,
segmentation,you want to create awareness on the role of males in family planning services your target audience could be married males and male adolescents. Such segmentation of your audience makes your health education more effective. Routine vaccination is among the activities you will b,,,,,,
Segmentation,"(grouped), and communications can be made using mass media and through community leaders and elders to achieve defined behavioural objectives. Segmentation refers to targeting key messages to the relevant audience at the relevant time. This helps prevent information overload for people, by ensuring they ",,,,,,
segmented,"efs and practices, BCC can promote nutritional improvements and address local traditions and household dynamics (conditions). Audiences are carefully segmented (grouped), and communications can be made using mass media and through community leaders and elders to achieve defined behavioural objectives. ",,,,,,
seizures,"Epilepsy is characterised by recurrent seizures (sometimes called fits). A seizure is caused by a sudden burst of excess electrical activity in the brain, causing a temporary disruption in the normal messages passing between brain cells. This disruption results in the brain's messages becom",,,,,,
Self-awareness,"in a single person. It is usually considered that there are three aspects of intrapersonal communication, self-awareness, perception and expectation. Self-awareness is the part of intrapersonal communication that determines how a person sees him or herself â€” and how they are oriented toward others. Self-awarene",,,,,,
self-efficacy,"the person, object or action. Self-efficacy The most important predisposing factor for self-regulating one's behaviour is seen to be self-efficacy, that is the person's perception of how successful he or she can be in performing a particular behaviour. Self-efficacy is learning why particular be",,,,,,
self-limiting,"the epidemic. This is especially important if the epidemic has unusual features, if it presents a significant threat to public health, and it is not self-limiting (i.e. it does not end spontaneously without professional intervention). Epidemic investigation is a challenging task for health workers. The m",,,,,,
self-regulatory,"is not taking adequate amounts of the nutrients for her own needs. Moreover it is free of contamination and does not need any preparation. It is also self-regulatory; breastmilk secretion occurs based on the need of the infant, so if there is more feeding there will be more secretion. If the mother tries to introd",,,,,,
Self-treatment,"t mental healthcare is available for people with mental illness in Ethiopia. At the bottom, the biggest part of the triangle is labelled 'self-care'. Self-treatment describes how the person with mental illness does things to try to help themselves, e.g. talks to someone they trust about their problems, stops drin",,,,,,
septicaemia,"elopment of infection in the abdominal cavity is called peritonitis; infection disseminated around the body in the blood circulation is called septicaemia. If the woman survives the initial rupture but remains untreated for more than about 6 hours, the risk of one or both of these conditions occurring i",,,,,,
Serological,"is described in Study Session 24 of Communicable Diseases, Part 3. Study Session 28 of that Module deals with HIV in children. Serological (or antibody) tests (also called rapid tests) detect antibodies made by immune cells in response to the virus. They do not detect th",,,,,,
sewage,"b>which together are known as excreta. All human body waste is classed as liquid waste. The mixture of human waste with wastewater is known as sewage and also sometimes known as blackwater. Runoff is simply rainwater that collects on the ground and runs off into channels, ditches and rivers.",,,,,,
