osteoporosis,"an happen as a result of minimal force if the bone is weak due to underlying disease (e.g. osteoporosis, or bone cancer). If you have not come across osteoporosis before, it means softening of the bones due to reduction in the concentration of calcium in the bone. This condition is more common in older persons ",,,,,,
outbreak,"number, but it lasts for only a short time, or it occurs only in a limited area (e.g. in a few nearby households), the rise may be referred to as an outbreak. As you will remember from Study Session 1 of this Module, an epidemic is also an excess of cases compared with the number expected",,,,,,
Overdose,"parent that this is normal, symptoms will pass and no medical treatment is necessary Not harmful Overdose Vomiting and lethargy/listlessness YES, if protocol is followed Refer for medical treatment ",,,,,,
ovulation,"g hormone (LH) is also produced by the pituitary gland in the brain. It stimulates the ovaries to produce oestrogen and progesterone. It triggers ovulation (the release of a mature ovum from the ovary), and it promotes the development of the corpus luteum. What is the ",,,,,,
Oxytocin,"ng Contractions per 10 mins (minutes) initially and every 30 minutes. Below that are two rows for recording administration of Oxytocin during labour and the amount given. (You are NOT supposed to do this â€“ it is for a doctor to decide! However, you will be trained to give oxytocin ",,,,,,
Oxytocin,"ired, and it does not need to be stored in a refrigerator so it can be used where there is no way of keeping drugs very cold. Oxytocin is the recommended uterotonic drug in all situations where it is feasible to use it, because it is more effective than the other drugs and has fewer ",,,,,,
PAB,"n abbreviated to TT2+ (because more than two doses of TT vaccine have been given). Percentage of children protected at birth (PAB) from neonatal tetanus, because their mother received a valid dose of TT2+ vaccination at least two weeks before delivery (Figure 8.7). ",,,,,,
pacifiers,"a high water content to quench the infant's thirst, and 'hind milk' which is rich in fat and nutrients. The mother should not give bottles and pacifiers (dummies) to her breastfed infant because they can interfere with breastfeeding and cause diarrhoea and other possibly serious infections as they are",,,,,,
palatable,"on of blood circulation and the nervous system. As well as being nutritious and balanced (Figure 7.3), to fulfil our needs food should also be palatable (which means tasty and good to eat) and culturally and psychologically acceptable. We should want to eat the food and have no cultural and social dif",,,,,,
pallor,"mes far less); she complains of dizziness; she seems confused and may even lose consciousness. You should look for signs such as pallor: her fingernails, the palms of her hands and the inside of her eyelids will turn whiter as she loses blood. She may tell you she feels weak or be una",,,,,,
Palpation,"Palpation means feeling the abdomen with your hands in specific positions, or moving them in particular ways, using certain levels of pressure. Ask the mother to lie down on her back and bend her legs at the knees, with her feet flat on the bed. You need to be able to move around her: sometimes you will b",,,,,,
papules,"metimes the lesion may be reddish or copper-coloured. The variety of skin lesions which may be commonly seen include macules (which are flat), papules (raised), and nodules. Figure 18.2 (a) Nodul",,,,,,
paralysis,"Poliomyelitis (usually called polio) is a viral disease that causes paralysis (weakness or inability to use the muscles) of the legs, arms or hands. Polio is caused by three types of viruses, namely, poliovirus types 1, 2 or 3; (note that 'poliovirus' is all one word). Many countries agreed ",,,,,,
parasitological,"irm the clinical diagnosis using specific tests to identify the presence of the malaria parasite or its products in the blood. This process is called parasitological or parasite-based diagnosis. In areas with a risk of malaria, or in patients who have travelled back from malaria-endemic areas, fever should ",,,,,,
partograph,eels she wants to push down through her lower abdomen. In Study Session 4 you will learn how to use a chart called a partograph to assess the progress of labour and record your observations and measurements accurately. But first we are going to describe what happens in the wom,,,,,,
partograph,"The partograph is a graphical presentation of the progress of labour, and of fetal and maternal condition during labour. It is the best tool to help you detect whether labour is progressing normally or abnormally, and to warn you as soon as possible if there are signs of fetal distress or if the mother's v",,,,,,
Pasteurisation,"ion. Pasteurisation Pasteurisation is named after its inventor, Louis Pasteur, a French chemist. Pasteurisation is a process of heat treatment of milk, beer and some other beverages. It requires sufficient holding time to assure the thermal destruction of patho",,,,,,
pathogenic,"cting us against invasion by infectious agents (see Figure 20.3). In the absence of an effective immune system, our bodies would easily be invaded by pathogenic (disease-causing) viruses, bacteria, protozoa and parasites, which would rapidly cause our death. The exact functioning of the immune system is very ",,,,,,
pathogens,"An opportunistic infection is an infection caused by harmful infectious agents, or pathogens (bacteria, viruses, fungi, parasites or protozoa), that usually do not cause disease in a healthy person, i.e. one with an immune system whose function is not impaired. Opportunistic infections observed in ",,,,,,
pathogens,"b>infectious agents. The main types of infectious agents are bacteria, viruses, fungi, protozoa and parasites. They are also often referred to as pathogens, which means â€˜disease-causing organismsâ€™. We will use both terms in this Module. Which of the following are infectious agents: the hepati",,,,,,
PCV10,"eveloped to give protection against different subsets of these strains. The vaccine that is being introduced in Ethiopia as part of the EPI is called PCV10, also known by its brand name Synflorix. PCV10 is highly effective at preventing infections caused by the strains of Streptococcus pneumoni",,,,,,
pelvis,"eal"">Show answer As you learned in Study Session 3 of this Module, young women may not have completed their growth so the pelvis (the bone surrounding the birth canal) is often still growing and immature which makes giving birth difficult. They may not have enough food and when",,,,,,
Percentage,"l number of responses. Proportions are very often converted to percentage values because this makes comparison easier between different sets of data. Percentage means the number of occurrences or responses, as a proportion of the whole, multiplied by 100. For example, if 30 people respond to a survey out of a",,,,,,
Perception,"s how a person sees him or herself â€” and how they are oriented toward others. Self-awareness involves three factors: beliefs, values and attitudes. Perception is about creating an understanding of both oneself and one's world â€” and being aware that one's perceptions of the outside world are also rooted in",,,,,,
percolation,"s the ground surface. Rainwater percolates (trickles down) through the soil into permeable layers of subsoil or underground rock. The downward percolation will be stopped if this layer sits on top of an impermeable layer and the water can go no further. Depending on the slope of the layers, the water wi",,,,,,
performing,"ces, they have more time and energy to spend on their objectives, and to start making significant progress. Stage 4 Performing At the performing stage, members begin diagnosing and solving problems, and implementing changes. They have accepted each other's strengths and weaknesses and learnt t",,,,,,
peritonitis,"abdominal cavity, and enter the blood circulation through the ruptured blood vessels. The development of infection in the abdominal cavity is called peritonitis; infection disseminated around the body in the blood circulation is called septicaemia. If the woman survives the initial rupture but remains ",,,,,,
pH,"ication of microorganisms in foods. pH pH is pronounced â€˜pee-aitch'. The scientific term pH is a measure of how acidic or alkaline an environment is, on a scale that has â€˜neutral' (neither acid nor alkaline) at pH7. Environments that are a",,,,,,
Pharingitis,"Pharingitis generally begins with the sudden onset of fever (temperature above 37.5oC, measured with a thermometer in the armpit), and a sore throat, with redness and swelling of the tonsils at the back of the throat (Figure 35.7). Other symptoms include headache, cough, runny nose and pain durin",,,,,,
pharyngitis,(white or yellow patches) on the throat and tonsils.The pharynx is the space behind the nose and the mouth. In a typical case of pharyngitis (sore throat) the pharynx is distinctly red and inflamed and the tonsils are enlarged and covered with yellow pus. There are complications of pharyng,,,,,,
physiology,Human physiology (the functioning of our bodies) is highly dependent on the immediate environment. Our environment should supply the necessary services and facilities for our physiological needs. For example: Breathing Breathing is a physiological process that utilises oxygen for energy pro,,,,,,
PID,"al problems associated with the complications arising from STIs. Fewer STIs means fewer complications like pelvic inflammatory disease (PID), inflammation of the uterus and fallopian tubes due to bacterial infection or other pathogens), infertility, ectopic pregnancy (pregnancy out",,,,,,
PITC,"anization (WHO) and health services in many countries, including Ethiopia, promote a policy of provider-initiated HIV testing and counselling (PITC). This means that when trained to do so, you should offer and provide HIV testing and counselling yourself. PITC enables specific clinical decisions ",,,,,,
placenta,"The placenta is a temporary organ required for the development of the embryo and fetus. It allows for the exchange of nutrients and oxygen from mother to fetus, and the transfer of fetal waste products back to the mother for disposal by her organs. There is no mixing of maternal and fetal blood in the pl",,,,,,
Planning,">Planning is an important skill for Health Extension Practitioners because it is a key management function for all healthworkers and health managers. Planning is the process of determining in advance what should be accomplished â€“ when, by whom, how and at what cost. Regardless of whether it is plan",,,,,,
planning,t the first thing she needed to do when she started her job was to collect baseline data in order to produce a community profile. So she began planning a community survey to collect data to build up the information for her community profile. She started documenting relevant facts from her previous kn,,,,,,
plasmodium,"Malaria is an infection of the red blood cells caused by a parasite called plasmodium that is carried by certain kinds of mosquitoes. A mosquito sucks up the malaria parasites in the blood of an infected person when it takes a blood 'meal', and then passes the parasites on when it bites someone else (Figur",,,,,,
platelets,"Blood is a fluid comprising red blood cells (see Figure 1.1), several types of white blood cells and small fragments of blood cells called platelets, which are involved in the blood clotting process. These cells are all suspended in yellowish or straw-coloured liquid called plasma. The r",,,,,,
PLHIV,"in a given period. In the context of HIV/AIDS, you will also come across the term people living with HIV (abbreviated to PLHIV) when describing epidemic statistics, and indeed when we talk about other aspects of this disease. PLHIV refers to everyone who is infected with the ",,,,,,
Pneumonia,"Pneumonia is a lower respiratory tract infection that mainly affects the lungs. The lungs are made up of small sacs called alveoli, which are filled with air when a healthy person breathes in. When an individual has pneumonia, the alveoli are filled with pus and fluid, which makes breathing painful",,,,,,
pneumonia,"ifficult breathing may occur when there is an infection of the respiratory tract. These infections may be severe respiratory tract infections such as pneumonia (acute) which require antibiotics for treatment, or they can be mild infections such as a cold, which can be treated by the family at home. H",,,,,,
podoconiosis,"in affected communities. Some people think it is caused by treading on a snake or frog, others that it is a curse or form of punishment. In reality, podoconiosis (Figure 39.15) is a reaction in the body to very small soil particles that have passed through the skin of the feet. The swelling begins in the feet ",,,,,,
polio,"Poliomyelitis (usually called polio) is a viral disease that causes paralysis (weakness or inability to use the muscles) of the legs, arms or hands. Polio is caused by three types of viruses, namely, poliovirus types 1, 2 or 3; (note that 'poliovirus' is all one word). Many countries agr",,,,,,
Poliomyelitis,"Poliomyelitis (usually called polio) is a viral disease that causes paralysis (weakness or inability to use the muscles) of the legs, arms or hands. Polio is caused by three types of viruses, namely, poliovirus types 1, 2 or 3; (note that 'poliovirus' is all one word). Many countries agreed in 1",,,,,,
poliomyelitis,"es and the WHO aims to eradicate it from the world. OPV gives protection against the three types of polioviruses (types 1, 2 and 3) that cause poliomyelitis (polio) â€” a crippling disease of the brain and spinal cord. What is the crippling effect of polio called?",,,,,,
pollutant,"ssarily pollutants. A contaminant is a minor substance, material or agent that is unwanted in the environment and may or may not be harmful. A pollutant is a contaminant which, due to its properties or amount or concentration, causes harm. Gases (carbon monoxide, ozone, nitrogen dioxides), chemical va",,,,,,
pollutants,"nclude pollutants. Pollution can be defined as the introduction into the natural environment (air, water or land) of substances (pollutants) that are liable to cause harm to human health or to animals, plants and the wider environment. Water pollution occurs when a river, lake or o",,,,,,
Polygamy, 'Polygamy' is a form of marriage in which a person marries more than one spouse.,,,,,,
polyhydramnios,"nal age of the fetus? If it is too small, the baby may not have developed properly; if it is too big, the woman may have twins, or a condition called polyhydramnios (too much amniotic fluid). If the abdomen is either too big or too small, refer the mother to a health facility. Shape: Does the abd",,,,,,
position,"ps you to assess the size of the fetus, its presentation (which part of the baby will 'present' at the cervix during delivery), and its position relative to the mother's body (e.g. is it facing towards her front or her back). There are four palpations of the abdomen, wh",,,,,,
post-adolescence,"0 and 24 years. In this Module we will use these definitions and also the terms early adolescence (10-14), late adolescence (15-19) and post-adolescence (20-24), because they are helpful in understanding the problems and designing appropriate interventions for young people of different ages. You will ",,,,,,
post-adolescents,"age 10-14), it is appropriate to talk about the changes during puberty and the benefits of abstinence and delaying sexual activity. By contrast, for post-adolescents (aged 20-24) education about faithfulness and safer sex using condoms is relevant as they are likely to have started sexual activity anyway. Similarl",,,,,,
Posterior,"Medial: towards the midline of the body Lateral: away from the midline (sides, edges) Anterior: in front of Posterior: behind, at the back of ",,,,,,
Potency,"on, because of possible loss of potency (vaccines; diluents) or durability (syringes, needles and other items). Potency refers to the â€˜strengthâ€™ or â€˜effectivenessâ€™ of a vaccine; durability refers to the time period that equipment such as syringes or need",,,,,,
Powers,"mes prolonged or obstructed may be due to one of the 'Ps' (as midwives and obstetricians call them): 'powers', 'passenger' and 'passage'. Powers: Inadequate power, due to poor or uncoordinated uterine contractions, is a major cause of prolonged labour. Either the uterine contractions ar",,,,,,
PPH,Postpartum haemorrhage (or PPH) is defined as excessive bleeding from the reproductive tract at any time following the baby's birth and up to six weeks after delivery.,,,,,,
Pre-eclampsia,"Pre-eclampsia is the commonest type of hypertensive disorder of pregnancy and the focus of much of the discussion in this section (see Table 19.2). It usually occurs in the second half of pregnancy (after 20 weeks of gestation, but most commonly after 28 weeks). The appearance of protein in the woman's urine ",,,,,,
Pre-testing,"Ideally, all health education messages should be pre-tested before being used more widely. Pre-testing is testing the message with representatives of your target audience before the message is disseminated to a wider audience. Without pre-testing, a message stands the chance of becoming ineffective and deta",,,,,,
Precipitation,"change from a liquid to a gas. When the sun shines on the surface of water, water molecules evaporate from the water body into the atmosphere above. Precipitation simply means water falling from the atmosphere to the Earth's surface; mostly this means rain, although it also includes snow. Runoff includes",,,,,,
prejudice,"a. Stigma refers to the way in which a characteristic, e.g. mental illness, marks the person out as different and leads to negative attitudes (prejudice) and behaviour (discrimination) from other people. This stigma increases the burden of illness further. People with mental illness may also ex",,,,,,
presentation,"> Show answer Palpation helps you to assess the size of the fetus, its presentation (which part of the baby will 'present' at the cervix during delivery), and its position relative to the mother's body (e.g. is it facing towar",,,,,,
Prevalence,"incidence rates can also be expressed as 'per 10,000' or 'per 100,000' in much larger populations, e.g. of a region or a whole country. Prevalence refers to the total number of cases existing in the population at a point in time, or during a given period (e.g. a particular month or year). The nu",,,,,,
Prevalence,"Elimination is defined as reaching a prevalence rate of less than one leprosy case per 10,000 population. Prevalence refers to the total number of cases existing at a given time. Box 18.1 Leprosy control measures E",,,,,,
Prevalence,"ame=""reveal"" id=""1"" class=""reveal"">Show answer Prevalence and incidence were described in Study Session 2 of this Module. Prevalence refers to the total number of cases of a particular disease or health condition existing in a population at a certain point in time, or during",,,,,,
prevention,nicable diseases. This knowledge will help you to identify prevention and control measures that can be applied at each link in the chain. When we say prevention it refers to measures that are applied to prevent the occurrence of a disease. When we say control it refers to measures that are applied to p,,,,,,
Primacy,"Primacy, the state of being first, often creates a strong impression which may be very difficult to change. Things learned first create a strong impression in the mind that is difficult to erase. 'Unteaching' or erasing from the mind incorrect first impressions is harder than teaching them correctly in ",,,,,,
primigravida,"vious pregnancies, regardless of the outcome, including spontaneous miscarriage or abortion before 28 weeks of gestation. Gravida 1 or primigravida: first pregnancy Gravida 2: second pregnancy, etc. Multigravida: pregnant two or more times (number not specified) ",,,,,,
primigravida,"pertensive disorders may complicate up to 10% of all pregnancies, with the highest proportion occurring in women who are pregnant for the first time (primigravida). Hypertension is usually defined as blood pressure above 140/90 mmHg, where the top number is the systolic pressure and the bottom number is ",,,,,,
Prioritisation,"heir causes, the next step is to prioritise these problems â€” because it may be difficult for you to address all of these problems at the same time. Prioritisation is the process of arranging the problems in order of the urgency in which they need to be addressed. Highly urgent and important problems are put at ",,,,,,
Prioritisation,"Prioritisation is the process of informed decision-making about what to do first, second, third and so on, when there are competing claims on human and other resources. It is impossible to solve all problems at once because there are always many resource constraints. In order to select your priority activities",,,,,,
prioritising,"ill be expected to prioritise and make strategic choices in order to implement your health plan. One of the important skills you need is the skill of prioritising. When you set priorities, you decide what is most important to tackle first. You might think every problem is a priority and find it difficult",,,,,,
Privacy,"se contraception and, if so, which method. Safety â€” to have a safe abortion and to practise safe, effective contraception. Privacy â€” to have a private environment during counselling and services. Confidentiality â€” to be assured that any personal information wi",,,,,,
Progesterone,nant woman. It promotes the maturation and release of an ovum in every menstrual cycle. It is also produced by the placenta during pregnancy. Progesterone is produced by the corpus luteum in the ovary; its function is to prepare the endometrium (lining of the uterus) for the reception and develop,,,,,,
Progress,ssed during labour.,,,,,,
prolapse,"ygiene (as you will learn in later study sessions of this Module). This risk gets bigger if the labour is prolonged. The umbilical cord may prolapse (be pushed out ahead of the baby as the waters gush out through the cervix), or the cord may become trapped against the endometrial wall by the baby ",,,,,,
prolapse,"Prolapsed cord is a dangerous complication of PROM. One of the potentially fatal complications of PROM for the baby is umbilical cord prolapse. (The term 'prolapse' means 'pushing out of the proper place'.) When the membranes rupture, the umbilical cord may be washed downwards by the rushing",,,,,,
Promotion,"tion (history taking, physical examination and basic investigations) Intervention (prevention/prophylaxis and treatment) Promotion (health education/counselling and health service dissemination). Box 13.3 summarises the steps in this process. ",,,,,,
Prophylaxis,Prophylaxis (pronounced 'proff-ill-axis') means 'treatment aimed at prevention'.,,,,,,
proportion,"A proportion, sometimes called relative frequency, is simply the number of times the observation occurs in the data, divided by the total number of responses. Proportions are very often converted to percentage values because this makes comparison easier between different sets of data.",,,,,,
prostitution,"g people are also at a greater risk of substance abuse and may feel forced to resort to work in hazardous situations, including commercial sex work, (prostitution) which makes them likely to contract STIs, including HIV/AIDS, and have an unwanted pregnancy. Young women also face gender discrimination t",,,,,,
Proteins,", so you understand how to counsel a person with diabetes about selecting a suitable diet for their condition. The main food groups are: Proteins such as meat, fish, egg yolk and soya products; Fats such as butter and oil, and within foods such as cheese, cream and fatty meat;",,,,,,
Proteins,"than frying. Fats should be limited to help control body weight, especially 'hard' fats such as butter and animal lard. Proteins Protein is found in meat, fish, eggs, nuts, pulses and dairy products, and is recommended in a healthy diet. Avoid 'fatty' sources ",,,,,,
Proteins,"About 10â€“35% of calories should come from protein. Proteins are needed in our diets for growth (especially important for children, teens and pregnant women) and to improve immune functions. They also play an important role in making essential hormones and enzymes, in tissue repair, preserving lean musc",,,,,,
proteinuria,"curs in the second half of pregnancy (after 20 weeks of gestation, but most commonly after 28 weeks). The appearance of protein in the woman's urine (proteinuria) is a danger sign. Significant proteinura is defined as a positive urine dipstick test for protein with a result greater than or equal to +2 o",,,,,,
Protozoa,"th in an Overcrowded World, Chapter 2 Helminths are worms made up of many cells; for example, Ascaris lumbricoides. Protozoa are micro-organisms made up of one cell; for example, Plasmodium falciparum. Bacteria are also micro-organisms made up of one ce",,,,,,
Psychosis,"-headed, feeling faint, unsteady, loss of balance). Refer urgently: Yellow eyes Psychosis or confusion (Psychosis involves loss of contact with reality, usually with false beliefs about what is taking place or one's own identity (delusions), and seeing or hearing",,,,,,
psychosis,"Around 1 to 2% of the adult Ethiopian population, that is around 400,000 to 800,000 people across the country, are affected by psychosis. People with psychosis may believe things that aren't real, hear things that aren't there, and have disturbed behaviour. You will learn more about psychosis in Study Sessio",,,,,,
